protocol_version,opaque_item_id,revision_candidate_id,automated_triage,internal_decision,decision_basis,required_next_action,m05_required_probe,dissent_preserved,external_validation_status
m04-core-expert-kit.v0.2-targeted,NV2-001,SMRL-C11-r2,HOLD_FOR_RISK_REVIEW,CONSTRUCT_REWRITE,"blind first mapping은 SM_RL 3명·METHOD 3명으로 갈렸고, 4명이 CONSTRUCT_REWRITE를 권고했다. 알림 없이 기억하는 능력과 실제 역할 이행이 분리되지 않는다는 fatal risk를 유지한다.",알림·비보조 기억 조건을 제거하고 역할 확인과 이행 반응으로 새 major revision을 만든 뒤 제한 M04 재검토,기억 보조도구 사용 여부와 무관하게 같은 뜻으로 이해되는지 확인,YES,NOT_EXTERNAL_VALIDATION
m04-core-expert-kit.v0.2-targeted,NV2-002,SMOS-C10-r2,PASS_TO_COGNITIVE,PASS_TO_COGNITIVE,"6명 모두 SM_OS LOW로 mapping했고 5명이 KEEP을 권고했다. 보관 환경·권한·접근성 차이에 관한 1명의 수정 의견은 M05 확인 과제로 보존한다.",현재 문구를 M05 인지 인터뷰 후보로 이동,물리·디지털 자료와 개인 보관 공간 차이에서도 같은 위치 구조화 의미로 이해되는지 확인,YES,NOT_EXTERNAL_VALIDATION
m04-core-expert-kit.v0.2-targeted,NV2-003,ERWD-C06-r2,PASS_TO_COGNITIVE,COPY_REVISE,"target·방향 mapping은 6명 전원 일치했지만 6명 모두 COPY_REVISE를 권고했다. 부정형의 이중 처리와 행동 지연 경계 누락이 반복 지적됐다.",ER_WD LOW를 유지하면서 반복 걱정이 결정·착수를 늦추지 않는 반응을 짧고 비낙인적으로 수정,걱정이 거의 없는 사용자도 자연스럽게 빈도로 답할 수 있는지 확인,YES,NOT_EXTERNAL_VALIDATION
m04-core-expert-kit.v0.2-targeted,NV2-004,OEIE-C10-r2,PASS_TO_COGNITIVE,PASS_TO_COGNITIVE,"6명 모두 OE_IE LOW와 방향에 일치했고 6명 전원이 KEEP을 권고했다. 명확성·단일 반응성·보편성·척도 적합성 median이 모두 4다.",현재 문구를 M05 인지 인터뷰 후보로 이동,필요한 답에서 탐색을 멈춘다는 뜻이 효율성 평가나 지적 능력 평가로 읽히지 않는지 확인,NO,NOT_EXTERNAL_VALIDATION
m04-core-expert-kit.v0.2-targeted,NV2-005,RORN-P05-B-r2,PASS_TO_COGNITIVE,COPY_REVISE,"target·방향 mapping은 6명 전원 일치했지만 4명이 COPY_REVISE를 권고했다. 통제적으로 보이는 표현의 사회적 바람직성과 관계 권력 혼입이 반복 지적됐다.",RO_RN LOW의 선택 여지 축은 유지하면서 낙인·도덕 평가·적극적 의견 표현 혼입을 줄이는 문구로 수정,가족·친구·연인과 권력 차이가 작은 관계에서도 같은 뜻으로 답하는지 확인,YES,NOT_EXTERNAL_VALIDATION
m04-core-expert-kit.v0.2-targeted,NV2-006,SMOS-C08-r2,PASS_TO_COGNITIVE,COPY_REVISE,"target·방향 mapping은 6명 전원 일치했지만 4명이 COPY_REVISE를 권고했다. 시점 계획과 실제 시작 행동 및 일정 통제권이 한 문장에 섞였다.",시작 행동을 제거하고 사용자가 조정 가능한 상황에서 시점을 정하는 방식만 남기도록 수정,교대근무·돌봄·건강 변동처럼 일정 자율성이 낮은 사용자에게도 성향과 제약이 구분되는지 확인,YES,NOT_EXTERNAL_VALIDATION
m04-core-expert-kit.v0.2-targeted,NV2-007,SMOS-C13,PASS_TO_COGNITIVE,PASS_TO_COGNITIVE,"6명 모두 SM_OS LOW와 방향에 일치했고 4명이 KEEP을 권고했다. 업무·학업 절차 노출 차이에 관한 2명의 수정 의견은 M05 확인 과제로 보존한다.",현재 문구를 M05 인지 인터뷰 후보로 이동,여러 단계의 일을 자주 하지 않거나 외부 절차를 따르는 사용자도 자율적 확인 순서로 해석하는지 확인,YES,NOT_EXTERNAL_VALIDATION
m04-core-expert-kit.v0.2-targeted,NV2-008,OEIE-C09-r2,PASS_TO_COGNITIVE,COPY_REVISE,"target·방향 mapping은 6명 전원 일치했지만 KEEP 2·COPY_REVISE 3·CONSTRUCT_REWRITE 1로 갈렸다. 필요한 이해를 위한 탐색과 필요한 범위를 넘는 탐구가 분리되지 않는다는 의견이 우세했다.",OE_IE HIGH를 유지하면서 필요한 이해를 마친 뒤에도 이유·배경을 더 알아보는 반응으로 문맥을 수정,설명 난도·사전지식·자료 접근성이 아니라 추가 탐구 성향으로 답하는지 확인,YES,NOT_EXTERNAL_VALIDATION
